<?xml version="1.0" encoding="UTF-8" ?>
<sd:source xmlns:sd="http://flymine.org/sourcedescriptor/1.0"
           xmlns:xsi="http://www.w3.org/2001/XMLSchema-instance"
           xsi:schemaLocation="http://flymine.org/sourcedescriptor/1.0 http://www.flymine.org/download/schemas/sourcedescriptor.xsd"
           type="chado-db">

    <property name="source.db.name" required="true" />
    <property name="genus" required="true" />
    <property name="species" required="true" />
    <property name="taxonId">
        <validation><![CDATA[^\d+(\s\d+)*$]]></validation>
    </property>
    <property name="dataSourceName" />
    <property name="dataSetTitle" />
    <property name="processors" type="class" />
    
    <derivation antTask="have.db.tgt" />

</sd:source>
